{
  "protocol_version": "0.1",
  "schema": "localize-anything-knowledge-review-decision-v1",
  "run_id": "run-001",
  "pack_id": "institutional-zh-cn",
  "decision_id": "knowledge-review-decision-example",
  "candidate_id": "knowledge-candidate-example",
  "decision": "approve",
  "reviewer_role": "knowledge_reviewer",
  "reviewer_reference": "reviewer@example.com",
  "rationale": "Confirmed terminology within the institutional publicity scope.",
  "effective_scope": {
    "scope_type": "limited",
    "scenario": "institutional_publicity_case"
  },
  "source_artifact_references": ["knowledge-review-queue.json"],
  "created_at": "2026-01-01T00:00:00Z",
  "supersedes": [],
  "superseded_by": []
}
